Ticker,Description
EXC,"Exelon Corporation, a utility services holding company, engages in the energy generation, delivery, and marketing businesses in the United States and Canada. It owns nuclear, fossil, wind, hydroelectric, biomass, and solar generating facilities. The company also sells electricity to wholesale and retail customers; and sells natural gas, renewable energy, and other energy-related products and services. In addition, it is involved in the purchase and regulated retail sale of electricity and natural gas; and transmission and distribution of electricity, and distribution of natural gas to retail customers. Further, the company offers support services, including legal, human resources, information technology, financial, supply management, accounting, engineering, customer operations, distribution and transmission planning, asset management, system operations, and power procurement services. It serves distribution utilities, municipalities, cooperatives, and financial institutions, as well as commercial, industrial, governmental, and residential customers. The company was incorporated in 1999 and is headquartered in Chicago, Illinois."
FANG,"Diamondback Energy, Inc., an independent oil and natural gas company, focuses on the acquisition, development, exploration, and exploitation of unconventional and onshore oil and natural gas reserves in the Permian Basin in West Texas. It primarily focuses on the development of the Spraberry and Wolfcamp formations of the Midland basin; and the Wolfcamp and Bone Spring formations of the Delaware basin, which are part of the Permian Basin in West Texas and New Mexico. As of December 31, 2020, the company's total acreage position was approximately 449,642 gross acres in the Permian Basin; and estimated proved oil and natural gas reserves were 1,316,441 thousand barrels of crude oil equivalent. It also held working interests in 4,326 gross producing wells, as well as royalty interests in 4,553 additional wells. In addition, the company owns mineral interests approximately 787,264 gross acres and 24,350 net royalty acres in the Permian Basin and Eagle Ford Shale; and owns, operates, develops, and acquires midstream infrastructure assets, including 927 miles of crude oil gathering pipelines, natural gas gathering pipelines, and an integrated water system in the Midland and Delaware Basins of the Permian Basin. Diamondback Energy, Inc. was founded in 2007 and is headquartered in Midland, Texas."
FE,"FirstEnergy Corp., through its subsidiaries, generates, transmits, and distributes electricity in the United States. The company operates through Regulated Distribution and Regulated Transmission segments. It operates 24,035 circuit miles of overhead and underground transmission lines; and electric distribution systems, including 272,531 miles of overhead pole line and underground conduit carrying primary, secondary, and street lighting circuits, as well as owns substations with a total installed transformer capacity of approximately 155,920,348 kilovolt-amperes. The company serves approximately 6 million customers in Ohio, Pennsylvania, West Virginia, Maryland, New Jersey, and New York. FirstEnergy Corp. was incorporated in 1996 and is headquartered in Akron, Ohio."
FTI,"TechnipFMC plc engages in the oil and gas projects, technologies, and systems and services businesses. It operates through two segments, Subsea and Surface Technologies. The Subsea segment designs and manufactures products and systems; performs engineering, procurement, and project management; and provides services used by oil and gas companies involved in offshore exploration and production of crude oil and natural gas. The Surface Technologies segment designs and manufactures systems, as well as provides services used by oil and gas companies involved in the land and shallow water exploration and production of crude oil and natural gas. This segment also designs, manufactures, and supplies technologically advanced wellhead systems, and high pressure valves and pumps used in stimulation activities for oilfield service companies, as well as provides installation, flowback, and other services for exploration and production companies. It operates in Europe, Russia, Central Asia, the Americas, the Asia Pacific, Africa, and the Middle East. The company was incorporated in 2015 and is headquartered in London, the United Kingdom."
HAL,"Halliburton Company provides a range of services and products to oil and natural gas companies worldwide. The company's Completion and Production segment offers production enhancement services, including stimulation and sand control services; and cementing services, such as well bonding and casing, as well as provides casing equipment. It also provides completion tools that offer downhole solutions and services, including well completion products and services, intelligent well completions, liner hanger and sand control systems, and service tools; production solutions comprising coiled tubing, hydraulic workover units, downhole tools, pumping services, and nitrogen services; and pipeline and process services, such as pre-commissioning, commissioning, maintenance, and decommissioning. In addition, this segment offers electrical submersible pumps, as well as artificial lift services. The company's Drilling and Evaluation segment provides drilling fluid systems, performance additives, completion fluids, solids control, specialized testing equipment, and waste management services; oilfield completion, production, and downstream water and process treatment chemicals and services; and drilling systems and services. It also offers wireline and perforating services, including open-hole logging, and cased-hole and slickline; and drill bits and services comprising roller cone rock bits, fixed cutter bits, hole enlargement, and related downhole tools and services, as well as coring equipment and services. In addition, this segment provides cloud based digital services and artificial intelligence solutions on an open architecture for subsurface insights, integrated well construction, and reservoir and production management; testing and subsea services, such as acquisition and analysis of reservoir information and optimization solutions; and project management and integrated asset management services. Halliburton Company was founded in 1919 and is based in Houston, Texas."
HES,"Hess Corporation, an exploration and production company, explores, develops, produces, purchases, transports, and sells crude oil, natural gas liquids (NGLs), and natural gas. The company operates through two segments, Exploration and Production, and Marketing and Refining. It conducts production operations primarily in the United States, Denmark, the Malaysia/Thailand Joint Development Area, and Malaysia; and exploration activities primarily offshore Guyana, Suriname, Canada, and in the Gulf of Mexico. As of December 31, 2020, the company had total proved reserves of 1,077 million barrels of oil equivalent. It is also involved in the gathering, compressing, and processing of natural gas; fractionating NGLs; gathering, terminaling, loading, and transporting crude oil and NGLs through rail car; storing and terminaling propane, as well as providing water handling services primarily in the Bakken Shale plays in the Williston Basin area of North Dakota. The company was incorporated in 1920 and is headquartered in New York, New York."
HFC,"HollyFrontier Corporation operates as an independent petroleum refiner in the United States. The company operates through three segments: Refining, Lubricants and Specialty Products, and HEP. It primarily produces high-value light products, such as gasoline, diesel and jet fuel, and specialty lubricant products, as well as specialty and modified asphalt. The company offers its products to other refiners, convenience store chains, independent marketers, retailers, truck stop chains, wholesalers, railroads, governmental entities, and paving contractors or manufacturers, as well as for commercial airline use. It owns and operates 4 refineries with a combined crude oil processing capacity of approximately 405,000 barrels per day in El Dorado, Kansas; Tulsa, Oklahoma; Artesia, New Mexico; and Woods Cross, Utah. The company also owns and operates vacuum distillation and other facilities in Lovington, New Mexico, as well as asphalt terminals in Arizona, New Mexico, and Oklahoma. Its refineries serve markets in the Mid-Continent, Southwest, and Rocky Mountain regions of the United States. In addition, HollyFrontier Corporation produces base oils and other specialized lubricant products; and owns and operates logistic assets consisting of petroleum product and crude oil pipelines, terminals, tankage, loading rack facilities, and refinery processing units. The company was formerly known as Holly Corporation and changed its name to HollyFrontier Corporation as a result of its merger with Frontier Oil Corporation in July 2011. HollyFrontier Corporation was incorporated in 1947 and is headquartered in Dallas, Texas."
KMI,"Kinder Morgan, Inc. operates as an energy infrastructure company in North America. The company operates through Natural Gas Pipelines, Products Pipelines, Terminals, and CO2 segments. The Natural Gas Pipelines segment owns and operates interstate and intrastate natural gas pipeline, and underground storage systems; natural gas gathering systems and natural gas processing and treating facilities; natural gas liquids fractionation facilities and transportation systems; and liquefied natural gas liquefaction and storage facilities. The Products Pipelines segment owns and operates refined petroleum products, and crude oil and condensate pipelines; and associated product terminals and petroleum pipeline transmix facilities. The Terminals segment owns and/or operates liquids and bulk terminals that stores and handles various commodities, including gasoline, diesel fuel, chemicals, ethanol, metals, and petroleum coke; and owns tankers. The CO2 segment produces, transports, and markets CO2 to recovery and production crude oil from mature oil fields; and owns interests in/or operates oil fields and gasoline processing plants, as well as operates a crude oil pipeline system in West Texas. It owns and operates approximately 83,000 miles of pipelines and 144 terminals. The company was formerly known as Kinder Morgan Holdco LLC and changed its name to Kinder Morgan, Inc. in February 2011. Kinder Morgan, Inc. was founded in 1936 and is headquartered in Houston, Texas."
LNT,"Alliant Energy Corporation operates as a utility holding company that provides regulated electricity and natural gas services in the Midwest region of the United States. It operates in three segments: Utility Electric Operations, Utility Gas Operations, and Utility Other. The company, through its subsidiary, Interstate Power and Light Company (IPL), primarily generates and distributes electricity, and distributes and transports natural gas to retail customers in Iowa; sells electricity to wholesale customers in Minnesota, Illinois, and Iowa; and generates and distributes steam in Cedar Rapids, Iowa. Alliant Energy Corporation, through its other subsidiary, Wisconsin Power and Light Company (WPL), generates and distributes electricity, and distributes and transports natural gas to retail customers in Wisconsin; and sells electricity to wholesale customers in Wisconsin. As of December 31, 2020, IPL supplied electric and natural gas service to approximately 495,000 and 225,000 retail customers respectively; and WPL supplied electric and natural gas service to approximately 480,000 and 195,000 retail customers, respectively. It serves retail customers in the farming, agriculture, industrial manufacturing, chemical, and packaging and food industries. In addition, the company owns and operates a short-line rail freight service in Iowa; a barge, rail, and truck freight terminal on the Mississippi River; and a rail-served warehouse in Cedar Rapids, Iowa, as well as offers freight brokerage and logistics management services. Further, it holds interests in a 347 megawatt (MW) natural gas-fired electric generating unit near Sheboygan Falls, Wisconsin; and a 225 MW wind farm located in Oklahoma. The company was incorporated in 1981 and is headquartered in Madison, Wisconsin."
MPC,"Marathon Petroleum Corporation, together with its subsidiaries, engages in refining, marketing, retailing, and transporting petroleum products primarily in the United States. It operates in two segments: Refining & Marketing, and Midstream. The Refining & Marketing segment refines crude oil and other feedstocks at its refineries in the Gulf Coast, Mid-Continent, and West Coast regions of the United States; and purchases refined products and ethanol for resale. Its refined products include transportation fuels, such as reformulated gasolines and blend-grade gasolines; heavy fuel oil; and asphalt. This segment also manufactures aromatics, propane, propylene, and sulfur. It sells refined products to wholesale marketing customers domestically and internationally, buyers on the spot market, and independent entrepreneurs who operate primarily Marathon branded outlets; and transportation fuels through long-term fuel supply contracts to direct dealer locations, primarily under the ARCO brand. The Midstream segment transports, stores, distributes, and markets crude oil and refined products through refining logistics assets, pipelines, terminals, towboats, and barges; gathers, processes, and transports natural gas; and gathers, transports, fractionates, stores, and markets natural gas liquids. The company also sell refined products for export to international customers. As of December 31, 2020, it operated 7,090 branded outlets in 35 states, the District of Columbia, and Mexico through independent entrepreneurs. The company also operates crude oil and refined product pipelines. Marathon Petroleum Corporation was founded in 1887 and is headquartered in Findlay, Ohio."
MRO,"Marathon Oil Corporation operates as an independent exploration and production company in the United States and Equatorial Guinea. The company engages in the exploration, production, and marketing of crude oil and condensate, natural gas liquids, and natural gas; and the production and marketing of products manufactured from natural gas, such as liquefied natural gas and methanol, as well as owns and operates 32 central gathering and treating facilities and the Sugarloaf gathering system, a 42-mile natural gas pipeline through Karnes and Atascosa Counties. As of December 31, 2020, it had estimated proved developed reserves totaling 674 million barrels of oil equivalent (mmboe); and estimated proved undeveloped reserves totaling 298 mmboe. The company was formerly known as USX Corporation and changed its name to Marathon Oil Corporation in July 2001. Marathon Oil Corporation was founded in 1887 and is headquartered in Houston, Texas."
NEE,"NextEra Energy, Inc., through its subsidiaries, generates, transmits, distributes, and sells electric power to retail and wholesale customers in North America. The company generates electricity through wind, solar, nuclear, and fossil fuel, such as coal and natural gas facilities. It also develops, constructs, and operates long-term contracted assets with a focus on renewable generation facilities, electric transmission facilities, and battery storage projects; and owns, develops, constructs, manages and operates electric generation facilities in wholesale energy markets. As of December 31, 2020, the company operated approximately 28,400 megawatts of net generating capacity. It serves approximately 11 million people through approximately 5.6 million customer accounts in the east and lower west coasts of Florida with approximately 76,200 circuit miles of transmission and distribution lines and 673 substations. The company was formerly known as FPL Group, Inc. and changed its name to NextEra Energy, Inc. in 2010. NextEra Energy, Inc. was founded in 1925 and is headquartered in Juno Beach, Florida."
NI,"NiSource Inc., an energy holding company, operates as a regulated natural gas and electric utility company in the United States. The company operates through two segments, Gas Distribution Operations and Electric Operations. It provides natural gas services and transportation for residential, commercial, and industrial customers; generates, transmits, and distributes electricity; and wholesale and transmission transaction services. The company owns and operates two coal-fired electric generating stations with a capacity of 2,080 megawatts (MW); combined cycle gas turbine with a capacity of 571 MW; two gas-fired generating units with a capacity of 155 MW; and two hydroelectric generating plants with a capacity of 10 MW. It serves approximately 4 million natural gas customers in six states under the Columbia Gas and NIPSCO brands; and 500,000 electricity customers in the northern part of Indiana. The company was formerly known as NIPSCO Industries, Inc. and changed its name to NiSource Inc. in April 1999. NiSource Inc. was founded in 1847 and is headquartered in Merrillville, Indiana."
NOV,"NOV Inc. designs, constructs, manufactures, and sells systems, components, and products for use in oil and gas drilling and production, and industrial and renewable energy sectors worldwide. It operates through three segments: Wellbore Technologies, Completion & Production Solutions, and Rig Technologies. The company offers various equipment and technologies used to perform drilling operations. It also provides solids control and waste management equipment and services; portable power generation products; drill and wired pipes; drilling optimization and automation services; tubular inspection, repair, and coating services; instrumentation, and measuring and monitoring services; downhole and fishing tools; and drill bits. The company offers equipment and technologies for hydraulic fracture stimulation, including pressure pumping trucks, blenders, sanders, hydration and injection units, flowline, and manifolds; well intervention, such as coiled tubing and wireline units, as well as blowout preventers and tools; onshore production comprising fluid processing systems, composite pipes, surface transfer and progressive cavity pumps, and artificial lift systems; fluid processing and floating production systems, and subsea production technologies; and connectors for conductor pipes. It also provides substructures, derricks, and masts; cranes; jacking systems; pipe lifting, racking, rotating, and assembly systems; mud pumps; blowout preventers; drives and generators; rig instrumentation and control systems; mooring, anchor, and deck handling machinery; equipment components for offshore wind construction vessels; and pipelay and construction systems. NOV Inc. offers spare parts, repair, and rentals, as well as remote equipment monitoring, technical support, field, and customer training services. The company was formerly known as National Oilwell Varco, Inc. and changed its name to NOV Inc. in January 2021. NOV Inc. was founded in 1862 and is based in Houston, Texas."
NRG,"NRG Energy, Inc., together with its subsidiaries, operates as an integrated power company in the United States. It operates through Texas, East, and West. The company is involved in the producing, selling, and delivering electricity and related products and services to 3.6 million residential, industrial, and commercial consumers. It generates electricity using natural gas, coal, oil, solar, nuclear, and battery storage. The company also provides system power, distributed generation, renewable products, backup generation, storage and distributed solar, demand response, energy efficiency, advisory, and on-site energy solutions; and carbon management and specialty services. In addition, it trades in electric power, natural gas, and related commodities; environmental products; weather products; and financial products, including forwards, futures, options, and swaps. Further, the company procures fuels; provides transportation services; and directly sells energy, services, and products and services to retail customers under the NRG, Reliant, Green Mountain Energy, Stream, XOOM Energy, and other brand names. As of December 31, 2020, it owns power generation portfolio with approximately 23,000 megawatts of capacity at 33 plants. NRG Energy, Inc. was founded in 1989 and is headquartered in Princeton, New Jersey."
OKE,"ONEOK, Inc., together with its subsidiaries, engages in gathering, processing, storage, and transportation of natural gas in the United States. It operates through Natural Gas Gathering and Processing, Natural Gas Liquids, and Natural Gas Pipelines segments. The company owns natural gas gathering pipelines and processing plants in the Mid-Continent and Rocky Mountain regions. It also gathers, treats, fractionates, and transports natural gas liquids (NGL), as well as stores, markets, and distributes NGL products. The company owns NGL gathering and distribution pipelines in Oklahoma, Kansas, Texas, New Mexico, Montana, North Dakota, Wyoming, and Colorado; terminal and storage facilities in Kansas, Missouri, Nebraska, Iowa, and Illinois; and NGL distribution and refined petroleum products pipelines in Kansas, Missouri, Nebraska, Iowa, Illinois, and Indiana, as well as owns and operates truck- and rail-loading, and -unloading facilities connected to NGL fractionation, storage, and pipeline assets. In addition, it operates regulated interstate and intrastate natural gas transmission pipelines and natural gas storage facilities. Further, the company owns and operates a parking garage in downtown Tulsa, Oklahoma; and leases excess office space. It operates 18,900 miles of natural gas gathering pipelines; 1,500 miles of FERC-regulated interstate natural gas pipelines; 5,100 miles of state-regulated intrastate transmission pipeline; and 6 NGL storage facilities. It serves integrated and independent exploration and production companies; NGL and natural gas gathering and processing companies; crude oil and natural gas production companies; propane distributors; municipalities; ethanol producers; and petrochemical, refining, and NGL marketing companies, as well as natural gas distribution companies, electric generation facilities, industrial companies, producers, processors, and marketing companies. The company was founded in 1906 and is headquartered in Tulsa, Oklahoma."
OXY,"Occidental Petroleum Corporation, together with its subsidiaries, engages in the acquisition, exploration, and development of oil and gas properties in the United States, the Middle East, Africa, and Latin America. The company operates through three segments: Oil and Gas, Chemical, and Marketing and Midstream. The company's Oil and Gas segment explores for, develops, and produces oil and condensate, natural gas liquids (NGLs), and natural gas. Its Chemical segment manufactures and markets basic chemicals, including chlorine, caustic soda, chlorinated organics, potassium chemicals, ethylene dichloride, chlorinated isocyanurates, sodium silicates, and calcium chloride; vinyls comprising vinyl chloride monomer, polyvinyl chloride, and ethylene. The company's Midstream and Marketing segment gathers, processes, transports, stores, purchases, and markets oil, condensate, NGLs, natural gas, carbon dioxide, and power. This segment also trades around its assets consisting of transportation and storage capacity; and invests in entities. Occidental Petroleum Corporation was founded in 1920 and is headquartered in Houston, Texas."
PEG,"Public Service Enterprise Group Incorporated, through its subsidiaries, operates as an energy company primarily in the Northeastern and Mid-Atlantic United States. It operates through two segments, PSE&G and PSEG Power. The PSE&G segment transmits electricity; distributes electricity and gas to residential, commercial, and industrial customers, as well as invests in solar generation projects, and energy efficiency and related programs; and offers appliance services and repairs. As of December 31, 2020, it had electric transmission and distribution system of 25,000 circuit miles and 860,000  poles; 54 switching stations with an installed capacity of 38,353 megavolt-amperes (MVA), and 245 substations with an installed capacity of 8,647 MVA; four electric distribution headquarters and five electric sub-headquarters; and 18,000 miles of gas mains, 12 gas distribution headquarters, two sub-headquarters, and one meter shop, as well as 58 natural gas metering and regulating stations. The Power segment operates nuclear, gas, oil-fired, and renewable generation assets. It has total generating output was approximately 52,900 gigawatts hours; and owns and operates 467 MW direct current of photovoltaic solar generation facilities. Public Service Enterprise Group Incorporated was incorporated in 1985 and is based in Newark, New Jersey."
