Ticker,Description
AEE,"Ameren Corporation, together with its subsidiaries, operates as a public utility holding company in the United States. It operates through four segments: Ameren Missouri, Ameren Illinois Electric Distribution, Ameren Illinois Natural Gas, and Ameren Transmission. The company engages in the rate-regulated electric generation, transmission, and distribution activities; and rate-regulated natural gas distribution and transmission businesses. It primarily generates electricity through coal, nuclear, and natural gas, as well as renewable sources, such as hydroelectric, wind, methane gas, and solar. The company serves residential, commercial, and industrial customers. The company was founded in 1881 and is headquartered in St. Louis, Missouri."
AEP,"American Electric Power Company, Inc., an electric public utility holding company, engages in the generation, transmission, and distribution of electricity for sale to retail and wholesale customers in the United States. It operates through Vertically Integrated Utilities, Transmission and Distribution Utilities, AEP Transmission Holdco, and Generation & Marketing segments. The company generates electricity using coal and lignite, natural gas, nuclear, and hydroelectric, as well as solar, wind, and other energy sources. It also supplies and markets electric power at wholesale to other electric utility companies, rural electric cooperatives, municipalities, and other market participants. The company owns, leases, or controls approximately 3,016 railcars, 411 barges, 6 towboats, and a coal handling terminal with approximately 18 million tons of annual capacity. American Electric Power Company, Inc. was incorporated in 1906 and is headquartered in Columbus, Ohio."
AES,"The AES Corporation operates as a diversified power generation and utility company. It owns and/or operates power plants to generate and sell power to customers, such as utilities, industrial users, and other intermediaries. The company also owns and/or operates utilities to generate or purchase, distribute, transmit, and sell electricity to end-user customers in the residential, commercial, industrial, and governmental sectors; and generates and sells electricity on the wholesale market. It uses a range of fuels and technologies to generate electricity, including natural gas, coal, pet coke, diesel, and oil, as well as renewables, such as hydro, solar, wind, energy storage, biomass, and landfill gas. The company owns and/or operates a generation portfolio of approximately 30,308 megawatts. It has operations in the United States, Puerto Rico, El Salvador, Chile, Colombia, Argentina, Brazil, Mexico, Central America, the Caribbean, Europe, and Asia. The company was formerly known as Applied Energy Services, Inc. and changed its name to The AES Corporation in April 2000. The AES Corporation was incorporated in 1981 and is headquartered in Arlington, Virginia."
APA,"APA Corporation, through its subsidiaries, explores for and produces oil and gas properties. It has operations in the United States, Egypt, and the United Kingdom, as well as has exploration activities offshore Suriname. It also operates gathering, processing, and transmission assets in West Texas, as well as holds ownership in four Permian-to-Gulf Coast pipelines. The company was founded in 1954 and is based in Houston, Texas."
ATO,"Atmos Energy Corporation, together with its subsidiaries, engages in the regulated natural gas distribution, and pipeline and storage businesses in the United States. It operates in two segments, Distribution, and Pipeline and Storage. The Distribution segment is involved in the regulated natural gas distribution and related sales operations in eight states. This segment distributes natural gas to approximately three million residential, commercial, public authority, and industrial customers. As of September 30, 2020, it owned 71,558 miles of underground distribution and transmission mains. The Pipeline and Storage segment engages in the pipeline and storage operations. This segment transports natural gas for third parties and manages five underground storage reservoirs in Texas; and provides ancillary services to the pipeline industry, including parking arrangements, lending, and inventory sales. As of September 30, 2020, it owned 5,684 miles of gas transmission lines. Atmos Energy Corporation was founded in 1906 and is headquartered in Dallas, Texas."
AWK,"American Water Works Company, Inc., through its subsidiaries, provides water and wastewater services in the United States. It offers water and wastewater services to approximately 1,700 communities in 16 states serving approximately 3.5 million active customers. The company serves residential customers; commercial customers, such as food and beverage providers, commercial property developers and proprietors, and energy suppliers; fire service and private fire customers; industrial customers, such as large-scale manufacturers, mining, and production operations; public authorities comprising government buildings and other public sector facilities, such as schools and universities; and other utilities and community water and wastewater systems. It also provides various warranty protection programs to residential customers; and water and wastewater services on various military installations. In addition, the company undertakes contracts with municipal customers, primarily to operate and manage water and wastewater facilities, as well as offers other related services. It operates approximately 79 surface water treatment plants; 530 groundwater treatment plants; 150 wastewater treatment plants; 53,200 miles of transmission, distribution, and collection mains and pipes; 1,100 groundwater wells; 1,600 water and wastewater pumping stations; 1,300 treated water storage facilities; and 75 dams. The company serves approximately 15 million people with drinking water, wastewater, and other water-related services in 46 states. The company was founded in 1886 and is headquartered in Camden, New Jersey."
BKR,"Baker Hughes Company provides a portfolio of technologies and services worldwide. The company operates through four segments: Oilfield Services (OFS), Oilfield Equipment (OFE), Turbomachinery & Process Solutions (TPS), and Digital Solutions (DS). The OFS segment offers exploration, drilling, wireline, evaluation, completion, production, and intervention services; and drilling and completions fluids, completions tools and systems, wellbore intervention tools and services, artificial lift systems, pressure pumping systems, and oilfield and industrial chemicals for oil and natural gas, and oilfield service companies. The OFE segment designs and manufactures products and services, including subsea and surface pressure control and production systems and services, capital drilling equipment and services, and flexible pipe systems for offshore and onshore applications; and provides well intervention solutions, as well as services related to onshore and offshore drilling and production operations. The TPS segment provides equipment and related services for mechanical-drive, compression, and power-generation applications across the oil and gas industry. Its product portfolio includes drivers, compressors, and turnkey solutions; and pumps, valves, and compressed natural gas and small-scale liquefied natural gas solutions. This segment serves upstream, midstream, onshore and offshore, and industrial, as well as engineering, procurement, and construction companies. The DS segment provides sensor-based measurement, non-destructive testing and inspection, turbine, generator and plant controls, and condition monitoring, as well as pipeline integrity solutions for a range of industries, including oil and gas, power generation, aerospace, metals, and transportation. It serves through direct and indirect channels. The company was formerly known as Baker Hughes, a GE company and changed its name to Baker Hughes Company in October 2019. Baker Hughes Company is based in Houston, Texas."
CMS,"CMS Energy Corporation operates as an energy company primarily in Michigan. The company operates through four segments: Electric Utility, Gas Utility, Enterprises, and EnerBank. The Electric Utility segment is involved in the generation, purchase, transmission, distribution, and sale of electricity. This segment generates electricity through coal, wind, gas, renewable energy, oil, and nuclear sources. Its distribution system comprises 205 miles of high-voltage distribution overhead lines; 4 miles of high-voltage distribution underground lines; 4,428 miles of high-voltage distribution overhead lines; 19 miles of high-voltage distribution underground lines; 77,833 miles of electric distribution overhead lines; 9,264 miles of underground distribution lines; 1,096 substations; and 2 battery facilities. The Gas Utility segment engages in the purchase, transmission, storage, distribution, and sale of natural gas, which includes 2,410 miles of transmission lines; 15 gas storage fields; 27,958 miles of distribution mains; and 8 compressor stations. The Enterprises segment is involved in the independent power production and marketing, including the development and operation of renewable generation. It owns interests in independent power plants totalling 1,838 megawatts. The EnterBank segment operates an industrial bank providing unsecured installment loans for financing home improvements. It serves 1.9 million electric and 1.8 million gas customers, including residential, commercial, and diversified industrial customers. CMS Energy Corporation was founded in 1987 and is headquartered in Jackson, Michigan."
CNP,"CenterPoint Energy, Inc. operates as a public utility holding company in the United States. The company operates through Electric, Natural Gas, and Midstream Investments segments. The Electric segment includes electric transmission and distribution services to electric customers and electric generation assets, as well as assets in the wholesale power market. The Natural Gas segment provides natural gas distribution services, as well as home appliance maintenance and repair services to customers in Minnesota; and home repair protection plans to natural gas customers in Texas and Louisiana through a third party. This segment also sells regulated intrastate natural gas, as well as natural gas transportation and storage services for residential, commercial, industrial, and transportation customers. The Midstream Investments segment provides natural gas and crude oil gathering, and natural gas processing services to its producer customers, as well as crude oil, condensate, and produced water gathering services to its producer and refiner customers; and interstate and intrastate natural gas pipeline transportation and storage services to its producer, power plant, local distribution company, and industrial end-user customers. As of December 31, 2020, it served approximately 2.6 million metered customers; owned 239 substation sites with a total installed rated transformer capacity of 69,915 megavolt amperes; operated approximately 99,000 linear miles of natural gas distribution mains, as well as 77,000 linear miles of natural gas transmission mains; and owned and operated 264 miles of intrastate pipeline in Louisiana, Texas, and Oklahoma. CenterPoint Energy, Inc. was founded in 1866 and is headquartered in Houston, Texas."
COG,"Cabot Oil & Gas Corporation, an independent oil and gas company, explores for, exploits, develops, produces, and markets oil and gas properties in the United States. It primarily focuses on the Marcellus Shale with approximately 175,000 net acres in the dry gas window of the play located in Susquehanna County, Pennsylvania. The company sells its natural gas to industrial customers, local distribution companies, gas marketers, and power generation facilities through gathering systems and pipelines. As of December 31, 2020, it had proved reserves of approximately 13,672 billion cubic feet of gas; and 15 thousand barrels of oil or other liquid hydrocarbons. Cabot Oil & Gas Corporation was incorporated in 1989 and is headquartered in Houston, Texas."
COP,"ConocoPhillips explores for, produces, transports, and markets crude oil, bitumen, natural gas, liquefied natural gas (LNG), and natural gas liquids worldwide. The company primarily engages in the conventional and tight oil reservoirs, shale gas, heavy oil, LNG, oil sands, and other production operations. Its portfolio includes unconventional plays in North America; conventional assets in North America, Europe, Asia, and Australia; various LNG developments; oil sands assets in Canada; and an inventory of conventional and unconventional exploration prospects. The company was founded in 1917 and is headquartered in Houston, Texas."
CVX,"Chevron Corporation, through its subsidiaries, engages in integrated energy, chemicals, and petroleum operations worldwide. The company operates in two segments, Upstream and Downstream. The Upstream segment is involved in the exploration, development, and production of crude oil and natural gas; processing, liquefaction, transportation, and regasification associated with liquefied natural gas; transportation of crude oil through pipelines; and transportation, storage, and marketing of natural gas, as well as operates a gas-to-liquids plant. The Downstream segment engages in refining crude oil into petroleum products; marketing crude oil, refined products, and lubricants; transporting crude oil and refined products through pipeline, marine vessel, motor equipment, and rail car; and manufacturing and marketing commodity petrochemicals, and fuel and lubricant additives, as well as plastics for industrial uses. Chevron Corporation is also involved in the cash management and debt financing activities; insurance operations; real estate activities; and technology businesses. The company was formerly known as ChevronTexaco Corporation and changed its name to Chevron Corporation in 2005. Chevron Corporation was founded in 1879 and is headquartered in San Ramon, California."
D,"Dominion Energy, Inc. produces and distributes energy. The company operates through four segments: Dominion Energy Virginia, Gas Distribution, Dominion Energy South Carolina, and Contracted Assets. The Dominion Energy Virginia segment generates, transmits, and distributes regulated electricity to residential, commercial, industrial, and governmental customers in Virginia and North Carolina. The Gas Distribution segment engages in the regulated natural gas gathering, transportation, distribution, and sales activities, as well as distributes nonregulated renewable natural gas. This segment serves residential, commercial, and industrial customers. The Dominion Energy South Carolina segment generates, transmits, and distributes electricity and natural gas to residential, commercial, and industrial customers in South Carolina. The Contracted Assets segment is involved in the energy marketing and price risk activities. As of December 31, 2020, the company's portfolio of assets included approximately 30.2 gigawatt of electric generating capacity; 10,500 miles of electric transmission lines; 85,600 miles of electric distribution lines; and 94,200 miles of gas distribution lines. It serves approximately 7 million customers. The company sells electricity at wholesale prices to rural electric cooperatives and municipalities, as well as into wholesale electricity markets. The company was formerly known as Dominion Resources, Inc. and changed its name to Dominion Energy, Inc. in May 2017. Dominion Energy, Inc. was incorporated in 1983 and is headquartered in Richmond, Virginia."
DTE,"DTE Energy Company engages in the utility operations. The company's Electric segment generates, purchases, distributes, and sells electricity to approximately 2.2 million residential, commercial, and industrial customers in southeastern Michigan. It generates electricity through fossil-fuel, hydroelectric pumped storage, and nuclear plants, as well as wind and other renewable assets. This segment owns and operates approximately 698 distribution substations and 445,800 line transformers. The company's Gas segment purchases, stores, transports, distributes, and sells natural gas to approximately 1.3 million residential, commercial, and industrial customers throughout Michigan; and sells storage and transportation capacity. This segment has approximately 20,000 miles of distribution mains; 1,308,000 service pipelines; and 1,305,000 active meters, as well as owns approximately 2,000 miles of transmission pipelines. Its Gas Storage and Pipelines segment owns natural gas storage fields, lateral and gathering pipeline systems, and compression and surface facilities, as well as has ownership interests in interstate pipelines serving the Gulf Coast, Midwest, Ontario, and northeast markets. The company's Power and Industrial Projects segment offers metallurgical coke; pulverized coal and petroleum coke to the steel, pulp and paper, and other industries; and power, steam and chilled water production, and wastewater treatment services, as well as supplies compressed air to industrial customers. It also owns and operates 5 renewable generating plants with a capacity of 139 MWs; 22 gas recovery sites; and 10 reduced emissions fuel facilities. Its Energy Trading segment engages in power, natural gas, and environmental marketing and trading; structured transactions; and the optimization of contracted natural gas pipeline transportation and storage positions. The company was founded in 1903 and is headquartered in Detroit, Michigan."
DUK,"Duke Energy Corporation, together with its subsidiaries, operates as an energy company in the United States. It operates through three segments: Electric Utilities and Infrastructure, Gas Utilities and Infrastructure, and Commercial Renewables. The Electric Utilities and Infrastructure segment generates, transmits, distributes, and sells electricity in the Carolinas, Florida, and the Midwest; and uses coal, hydroelectric, natural gas, oil, renewable sources, and nuclear fuel to generate electricity. It also engages in the wholesale of electricity to municipalities, electric cooperative utilities, and load-serving entities. This segment serves approximately 7.9 million retail electric customers in 6 states in the Southeast and Midwest regions of the United States covering a service territory of approximately 91,000 square miles; and owns approximately 50,807 megawatts (MW) of generation capacity. The Gas Utilities and Infrastructure segment distributes natural gas to residential, commercial, industrial, and power generation natural gas customers; and owns, operates, and invests in pipeline transmission and natural gas storage facilities. It has approximately 1.6 million customers, including 1.1 million customers in North Carolina, South Carolina, and Tennessee, as well as 541,000 customers in southwestern Ohio and northern Kentucky. The Commercial Renewables segment acquires, owns, develops, builds, and operates wind and solar renewable generation projects, including nonregulated renewable energy and energy storage services to utilities, electric cooperatives, municipalities, and commercial and industrial customers. It has 21 wind, 150 solar, and 2 battery storage facilities, as well as 11 fuel cell locations with a capacity of 2,282 MW across 19 states. The company was formerly known as Duke Energy Holding Corp. and changed its name to Duke Energy Corporation in April 2005. The company was incorporated in 2005 and is headquartered in Charlotte, North Carolina."
DVN,"Devon Energy Corporation, an independent energy company, primarily engages in the exploration, development, and production of oil, natural gas, and natural gas liquids in the United States. It operates approximately 3,942 gross wells. Devon Energy Corporation was founded in 1971 and is headquartered in Oklahoma City, Oklahoma."
ED,"Consolidated Edison, Inc., through its subsidiaries, engages in the regulated electric, gas, and steam delivery businesses in the United States. The company offers electric services to approximately 3.5 million customers in New York City and Westchester County; gas to approximately 1.1 million customers in Manhattan, the Bronx, parts of Queens, and Westchester County; and steam to approximately 1,576 customers in parts of Manhattan. It also supplies electricity to approximately 0.3 million customers in southeastern New York and northern New Jersey; and gas to approximately 0.1 million customers in southeastern New York. The company operates 533 circuit miles of transmission lines; 15 transmission substations; 64 distribution substations; 89,673 in-service line transformers; 3,729 pole miles of overhead distribution lines; and 2,210 miles of underground distribution lines, as well as 4,341 miles of mains and 377,490 service lines for natural gas distribution. In addition, it owns, operates, and develops renewable and energy infrastructure projects; and provides energy-related products and services to wholesale and retail customers, as well as invests in electric and gas transmission projects. The company primarily sells electricity to industrial, commercial, residential, and government customers. Consolidated Edison, Inc. was founded in 1823 and is based in New York, New York."
EIX,"Edison International, through its subsidiaries, generates and distributes electric power. As of March 03, 2021, it delivered electricity to 15 million residential, commercial, industrial, public authorities, agricultural, and other customers across Southern, Central, and Coastal California. Edison International also provides energy solutions to commercial and industrial users. Its transmission facilities consist of lines ranging from 55 kV to 500 kV and substations; and distribution system consists of approximately 39,000 circuit-miles of overhead lines, approximately 31,000 circuit-miles of underground lines, and 800 substations. The company was founded in 1886 and is headquartered in Rosemead, California."
EOG,"EOG Resources, Inc., together with its subsidiaries, explores for, develops, produces, and markets crude oil, and natural gas and natural gas liquids. Its principal producing areas are in New Mexico and Texas in the United States; the Republic of Trinidad and Tobago; the People's Republic of China; and the Sultanate of Oman. As of December 31, 2020, it had total estimated net proved reserves of 3,220 million barrels of oil equivalent, including 1,514 million barrels (MMBbl) of crude oil and condensate reserves; 813 MMBbl of natural gas liquid reserves; and 5,360 billion cubic feet of natural gas reserves. The company was formerly known as Enron Oil & Gas Company. EOG Resources, Inc. was incorporated in 1985 and is headquartered in Houston, Texas."
ES,"Eversource Energy, a public utility holding company, engages in the energy delivery business. The company operates through Electric Distribution, Electric Transmission, Natural Gas Distribution, and Water Distribution segments. It is involved in the transmission and distribution of electricity; solar power facilities; and distribution of natural gas. The company operates regulated water utilities that provide water services to approximately 216,000 customers. It serves residential, commercial, industrial, municipal and fire protection, and other customers in Connecticut, Massachusetts, and New Hampshire. The company was formerly known as Northeast Utilities and changed its name to Eversource Energy in April 2015. Eversource Energy is based in Springfield, Massachusetts."
ETR,"Entergy Corporation, together with its subsidiaries, engages in the production and distribution of electricity in the United States. The company generates electricity through gas/oil, nuclear, coal, hydro, and solar power sources. It operates in two segments, Utility and Entergy Wholesale Commodities. The company's Utility segment generates, transmits, distributes, and sells electric power in portions of Arkansas, Mississippi, Texas, and Louisiana, including the City of New Orleans; and distributes natural gas. Its Entergy Wholesale Commodities segment engages in the ownership, operation, and decommissioning of nuclear power plants located in the northern United States; sale of electric power to wholesale customers; provision of services to other nuclear power plant owners; and owning interests in non-nuclear power plants that sell electric power to wholesale customers. It sells energy to retail power providers, utilities, electric power co-operatives, power trading organizations, and other power generation companies. The company's power plants have approximately 30,000 megawatts (MW) of electric generating capacity, which include 8,000 MW of nuclear power. The company delivers electricity to 3.0 million utility customers in Arkansas, Louisiana, Mississippi, and Texas. Entergy Corporation was incorporated in 1949 and is based in New Orleans, Louisiana."
EVRG,"Evergy, Inc., together with its subsidiaries, engages in the generation, transmission, distribution, and sale of electricity in Kansas and Missouri, the United States. It generates electricity through coal, hydroelectric, landfill gas, uranium, and natural gas and oil sources, as well as solar, wind, other renewable sources. The company has approximately 10,100 circuit miles of transmission lines; 39,800 circuit miles of overhead distribution lines; and 13,000 circuit miles of underground distribution lines. It serves approximately 1,620,400 customers, including residences, commercial firms, industrials, municipalities, and other electric utilities. Evergy, Inc. was incorporated in 2017 and is headquartered in Kansas City, Missouri."
