Ticker,Description
PNW,"Pinnacle West Capital Corporation, through its subsidiary, Arizona Public Service Company, provides retail and wholesale electric services primarily in the state of Arizona. The company engages in the generation, transmission, and distribution of electricity using coal, nuclear, gas, oil, and solar generating facilities. Its transmission facilities include approximately 5,728 pole miles of overhead lines and approximately 74 miles of underground lines; and distribution facilities comprise approximately 11,225 miles of overhead lines and approximately 22,453 miles of underground primary cable, as well as owns and maintains 80 transmission substations and 443 distribution substations. The company also owns or leases approximately 6,321 megawatts of regulated generation capacity. It serves approximately 1.3 million customers. The company was incorporated in 1985 and is headquartered in Phoenix, Arizona."
PPL,"PPL Corporation, a utility holding company, delivers electricity and natural gas in the United States and the United Kingdom. The company operates through three segments: U.K. Regulated, Kentucky Regulated, and Pennsylvania Regulated. It serves approximately 425,000 electric and 332,000 natural gas customers in Louisville and adjacent areas in Kentucky; 536,000 electric customers in central, southeastern, and western Kentucky; and 28,000 electric customers in five counties in southwestern Virginia. The company also provides electric delivery services to approximately 1.4 million customers in Pennsylvania; operates electricity distribution networks in the United Kingdom; generates electricity from coal, gas, hydro, and solar sources in Kentucky; and sells wholesale electricity to two municipalities in Kentucky. PPL Corporation was founded in 1920 and is headquartered in Allentown, Pennsylvania."
PSX,"Phillips 66 operates as an energy manufacturing and logistics company. It operates through four segments: Midstream, Chemicals, Refining, and Marketing and Specialties (M&S). The Midstream segment transports crude oil and other feedstocks; delivers refined petroleum products to market; provides terminaling and storage services for crude oil and refined petroleum products; transports, stores, fractionates, exports, and markets natural gas liquids; provides other fee-based processing services; and gathers, processes, transports, and markets natural gas. The Chemicals segment produces and markets ethylene and other olefin products; aromatics and styrenics products, such as benzene, cyclohexane, styrene, and polystyrene; and various specialty chemical products, including organosulfur chemicals, solvents, catalysts, and chemicals used in drilling and mining. The Refining segment refines crude oil and other feedstocks into petroleum products comprising gasolines, distillates, and aviation fuels at 13 refineries in the United States and Europe. The M&S segment purchases for resale and markets refined petroleum products consisting of gasolines, distillates, and aviation fuels primarily in the United States and Europe. It also manufactures and markets specialty products, such as base oils and lubricants. The company was founded in 1875 and is headquartered in Houston, Texas."
PXD,"Pioneer Natural Resources Company operates as an independent oil and gas exploration and production company in the United States. The company explores for, develops, and produces oil, natural gas liquids (NGLs), and gas. It has operations in the Permian Basin in West Texas. As of December 31, 2020, the company had proved undeveloped reserves and proved developed non-producing reserves of 31 million barrels of oil, 17 million barrels of NGLs, and 88 billion cubic feet of gas; and owned interests in 11 gas processing plants. Pioneer Natural Resources Company was founded in 1997 and is headquartered in Irving, Texas."
SLB,"Schlumberger Limited supplies technology for reservoir characterization, drilling, production, and processing to the oil and gas industry worldwide. It operates in four divisions: Digital & Integration, Reservoir Performance, Well Construction, and Production Systems. The company offers reservoir interpretation and data processing services; open and cased-hole, and slickline services; exploration and production pressure and flow-rate measurement services; tubing-conveyed perforating services; integrated production systems; software, consulting, information management, and IT infrastructure services; reservoir characterization, field development planning, and production enhancement consulting services; and petro technical data services and training solutions. It designs, manufactures, and markets roller cone and fixed cutter drill bits; supplies drilling fluid systems, fluid systems and specialty equipment, production technology solutions, and engineered managed pressure and underbalanced drilling solutions; and offers environmental services and products; provides drilling and measurement, land drilling rigs, and related support services; and supplies well planning and drilling, engineering, supervision, logistics, procurement, and contracting services, as well as drilling rig management services. In addition, the company offers well services; coiled tubing equipment; hydraulic fracturing, multistage completions, perforating, coiled tubing equipment, and services; well completion services and equipment; artificial lift production equipment and optimization services; and production management services. Further, it provides integrated subsea production systems; drilling equipment and services; onshore and offshore platform wellhead systems and processing solutions; and valve and process systems. The company was formerly known as Societe de Prospection Electrique. Schlumberger Limited was founded in 1926 and is based in Houston, Texas."
SO,"The Southern Company, through its subsidiaries, engages in the generation, transmission, and distribution of electricity. It operates in four segments: Gas Distribution Operations, Gas Pipeline Investments, Wholesale Gas Services, and Gas Marketing Services. The company also constructs, acquires, owns, and manages power generation assets, including renewable energy and battery energy storage projects and sells electricity in the wholesale market; and distributes natural gas in Illinois, Georgia, Virginia, and Tennessee, as well as provides gas marketing services, wholesale gas services, and gas pipeline investments operations. It owns and/or operates 30 hydroelectric generating stations, 24 fossil fuel generating stations, 3 nuclear generating stations, 13 combined cycle/cogeneration stations, 44 solar facilities, 13 wind facilities, 1 fuel cell facility, and 1 battery storage facility; and constructs, operates, and maintains 75,924 miles of natural gas pipelines and 14 storage facilities with total capacity of 157 Bcf to provide natural gas to residential, commercial, and industrial customers. The company serves approximately 8.6 million electric and gas utility customers. It also provides products and services in the areas of energy efficiency, and utility infrastructure. In addition, the company offers digital wireless communications and fiber optics services. The Southern Company was incorporated in 1945 and is headquartered in Atlanta, Georgia."
SRE,"Sempra Energy operates as an energy-services holding company in the United States and internationally. The company's San Diego Gas & Electric Company segment generates, transmits, and distributes electricity; and supplies natural gas. It offers electric services to approximately 3.7 million population and natural gas services to approximately 3.4 million population that covers 4,100 square miles. Its Southern California Gas Company segment owns and operates a natural gas distribution, transmission, and storage system that supplies natural gas to a population of approximately 22 million covering an area of 24,000 square miles. The company's Sempra Texas Utilities segment is involved in the regulated transmission and distribution of electricity serving 3.7 million homes and businesses, and operation of 139,000 miles of transmission and distribution lines. Its transmission system includes 18,127 circuit miles of transmission lines, 336 transmission stations, and 806 distribution substations; distribution system comprises 121,129 miles of overhead and underground lines; and 63 miles of electric transmission lines. Its Sempra Mexico segment develops, owns, operates, or holds interests in natural gas, electric, liquefied natural gas (LNG), liquid petroleum gas (LPG), ethane, and liquid fuels infrastructure; and purchases LNG, and purchases and sells natural gas. This segment operates natural-gas-fired, and wind and solar power generation facilities. Its assets/facilities consist of 1,850 miles of natural gas transmission pipelines, 15 compressor stations, and 139 miles of ethane pipelines; and 2,729 miles of natural gas distribution pipelines. The company's Sempra LNG segment develops and builds natural gas liquefaction export facilities; holds an interest in a facility for the export of LNG; owns and operates natural gas pipelines; and buys, sells, and transports natural gas. The company was founded in 1998 and is headquartered in San Diego, California."
VLO,"Valero Energy Corporation manufactures, markets, and sells transportation fuels and petrochemical products in the United States, Canada, the United Kingdom, Ireland, and internationally. It operates through three segments: Refining, Renewable Diesel, and Ethanol. The company is involved in oil and gas refining, marketing, and bulk selling activities. It produces conventional, premium, and reformulated gasolines; gasoline meeting the specifications of the California Air Resources Board (CARB); diesel fuels, low-sulfur and ultra-low-sulfur diesel fuels; CARB diesel; other distillates; jet fuels; blendstocks; lube oils and natural gas liquids; and asphalts, petrochemicals, lubricants, and other refined petroleum products. As of December 31, 2020, the company owned 15 petroleum refineries with a combined throughput capacity of approximately 3.2 million barrels per day. It sells its refined products through wholesale rack and bulk markets; and through approximately 7,000 outlets under the Valero, Beacon, Diamond Shamrock, Shamrock, Ultramar, and Texaco brands. The company also produces and sells ethanol, dry distiller grains, syrup, and inedible corn oil primarily to refiners and gasoline blenders, as well as to animal feed customers. It owns and operates 13 ethanol plants with a combined ethanol production capacity of approximately 1.69 billion gallons per year. In addition, the company owns and operates crude oil and refined petroleum products pipelines, terminals, tanks, marine docks, truck rack bays, and other logistics assets. Further, it owns and operates a plant that processes animal fats, used cooking oils, and other vegetable oils into renewable diesel. The company was formerly known as Valero Refining and Marketing Company and changed its name to Valero Energy Corporation in August 1997. Valero Energy Corporation was founded in 1980 and is headquartered in San Antonio, Texas."
WEC,"WEC Energy Group, Inc., through its subsidiaries, provides regulated natural gas and electricity, and renewable and nonregulated renewable energy services in the United States. The company operates through six segments: Wisconsin, Illinois, Other States, Electric Transmission, Non-Utility Energy Infrastructure, and Corporate and Other. It generates and distributes electricity from coal, natural gas, oil, hydroelectric, wind, solar, and biomass sources; provides electric transmission services; offers retail natural gas distribution services; transports natural gas; and generates, distributes, and sells steam. As of December 31, 2020, it operated approximately 36,100 miles of overhead distribution lines and 34,900 miles of underground distribution cables, as well as 450 electric distribution substations and 507,900 line transformers; 50,300 miles of natural gas distribution mains; 1,100 miles of natural gas transmission mains; 2.3 million natural gas lateral services; 500 natural gas distribution and transmission gate stations; and 68.2 billion cubic feet of working gas capacities in underground natural gas storage fields. The company was formerly known as Wisconsin Energy Corporation and changed its name to WEC Energy Group, Inc. in June 2015. WEC Energy Group, Inc. was incorporated in 1981 and is headquartered in Milwaukee, Wisconsin."
WMB,"The Williams Companies, Inc., together with its subsidiaries, operates as an energy infrastructure company primarily in the United States. It operates through Transmission & Gulf of Mexico, Northeast G&P, and West segments. The Transmission & Gulf of Mexico segment comprises Transco and Northwest natural gas pipelines; and natural gas gathering and processing, and crude oil production handling and transportation assets in the Gulf Coast region. The Northeast G&P segment engages in the midstream gathering, processing, and fractionation activities in the Marcellus Shale region primarily in Pennsylvania and New York, and the Utica Shale region of eastern Ohio. The West segment comprises gas gathering, processing, and treating operations in the Rocky Mountain region of Colorado and Wyoming, the Barnett Shale region of north-central Texas, the Eagle Ford Shale region of South Texas, the Haynesville Shale region of northwest Louisiana, and the Mid-Continent region, which includes the Anadarko, Arkoma, and Permian basins; and natural gas liquid (NGL) and natural gas marketing operations, as well as storage facilities. The company owns and operates 30,000 miles of pipelines, 34 processing facilities, 9 fractionation facilities, and approximately 23 million barrels of NGL storage capacity. The Williams Companies, Inc. was founded in 1908 and is headquartered in Tulsa, Oklahoma."
XEL,"Xcel Energy Inc., through its subsidiaries, generates, purchases, transmits, distributes, and sells electricity. It operates through Regulated Electric Utility, Regulated Natural Gas Utility, and All Other segments. The company generates electricity through coal, nuclear, natural gas, hydroelectric, solar, biomass, oil, wood/refuse, and wind energy sources. It also purchases, transports, distributes, and sells natural gas to retail customers, as well as transports customer-owned natural gas. In addition, the company develops and leases natural gas pipelines, and storage and compression facilities; and invests in rental housing projects, as well as procures equipment for the construction of renewable generation facilities. It serves residential, commercial, and industrial customers in the portions of Colorado, Michigan, Minnesota, New Mexico, North Dakota, South Dakota, Texas, and Wisconsin. The company sells electricity to approximately 3.7 million customers; and natural gas to approximately 2.1 million customers. Xcel Energy Inc. was incorporated in 1909 and is headquartered in Minneapolis, Minnesota."
XOM,"Exxon Mobil Corporation explores for and produces crude oil and natural gas in the United States and internationally. It operates through Upstream, Downstream, and Chemical segments. The company is also involved in the manufacture, trade, transport, and sale of crude oil, natural gas, petroleum products, petrochemicals, and other specialty products; and manufactures and sells petrochemicals, including olefins, polyolefins, aromatics, and various other petrochemicals. As of December 31, 2020, it had approximately 22,239 net operated wells with proved reserves. The company was founded in 1870 and is based in Irving, Texas."
